<?xml version="1.0" encoding="UTF-8"?>

<!-- Part of the open-source Proximity system (see LICENSE for 
     copyright and license information). -->

<!DOCTYPE PROX3DB SYSTEM "prox3db.dtd">
<PROX3DB NAME="Annot_DB04">
    <OBJECTS>
        <OBJECT ID="01"/>
        <OBJECT ID="02"/>
        <OBJECT ID="03"/>
        <OBJECT ID="04"/>
        <OBJECT ID="05"/>
    </OBJECTS>
    <LINKS>
        <LINK ID="01" O1-ID="01" O2-ID="02"/>
        <LINK ID="02" O1-ID="01" O2-ID="03"/>
        <LINK ID="03" O1-ID="01" O2-ID="04"/>
        <LINK ID="04" O1-ID="02" O2-ID="05"/>
        <LINK ID="05" O1-ID="03" O2-ID="05"/>
        <LINK ID="06" O1-ID="03" O2-ID="05"/>
    </LINKS>
    <ATTRIBUTES>
        <ATTRIBUTE NAME="ObjType" ITEM-TYPE="O" DATA-TYPE="STR">
            <ATTR-VALUE ITEM-ID="01">
                <COL-VALUE>Director</COL-VALUE>
            </ATTR-VALUE>
            <ATTR-VALUE ITEM-ID="02">
                <COL-VALUE>Movie</COL-VALUE>
            </ATTR-VALUE>
            <ATTR-VALUE ITEM-ID="03">
                <COL-VALUE>Movie</COL-VALUE>
            </ATTR-VALUE>
            <ATTR-VALUE ITEM-ID="04">
                <COL-VALUE>Movie</COL-VALUE>
            </ATTR-VALUE>
            <ATTR-VALUE ITEM-ID="05">
                <COL-VALUE>Academy Award</COL-VALUE>
            </ATTR-VALUE>
        </ATTRIBUTE>
        <ATTRIBUTE NAME="Name" ITEM-TYPE="O" DATA-TYPE="STR">
            <ATTR-VALUE ITEM-ID="01">
                <COL-VALUE>Ron Howard</COL-VALUE>
            </ATTR-VALUE>
        </ATTRIBUTE>
        <ATTRIBUTE NAME="Title" ITEM-TYPE="O" DATA-TYPE="STR">
            <ATTR-VALUE ITEM-ID="02">
                <COL-VALUE>Apollo 13</COL-VALUE>
            </ATTR-VALUE>
            <ATTR-VALUE ITEM-ID="03">
                <COL-VALUE>A Beautiful Mind</COL-VALUE>
            </ATTR-VALUE>
            <ATTR-VALUE ITEM-ID="04">
                <COL-VALUE>Far and Away</COL-VALUE>
            </ATTR-VALUE>
        </ATTRIBUTE>
        <ATTRIBUTE NAME="AwardName" ITEM-TYPE="O" DATA-TYPE="STR">
            <ATTR-VALUE ITEM-ID="05">
                <COL-VALUE>Best Picture</COL-VALUE>
            </ATTR-VALUE>
        </ATTRIBUTE>
        <ATTRIBUTE NAME="LinkType" ITEM-TYPE="L" DATA-TYPE="STR">
            <ATTR-VALUE ITEM-ID="01">
                <COL-VALUE>directed</COL-VALUE>
            </ATTR-VALUE>
            <ATTR-VALUE ITEM-ID="02">
                <COL-VALUE>directed</COL-VALUE>
            </ATTR-VALUE>
            <ATTR-VALUE ITEM-ID="03">
                <COL-VALUE>directed</COL-VALUE>
            </ATTR-VALUE>
            <ATTR-VALUE ITEM-ID="04">
                <COL-VALUE>nominated</COL-VALUE>
            </ATTR-VALUE>
            <ATTR-VALUE ITEM-ID="05">
                <COL-VALUE>nominated</COL-VALUE>
            </ATTR-VALUE>
            <ATTR-VALUE ITEM-ID="06">
                <COL-VALUE>won</COL-VALUE>
            </ATTR-VALUE>
        </ATTRIBUTE>
    </ATTRIBUTES>
</PROX3DB>
