<?xml version="1.0" encoding="UTF-8"?>

<!-- Part of the open-source Proximity system (see LICENSE for 
     copyright and license information). -->

<!DOCTYPE PROX3DB SYSTEM "prox3db.dtd">
<PROX3DB NAME="Const_DB04">
    <OBJECTS>
        <OBJECT ID="01"/>
        <OBJECT ID="02"/>
        <OBJECT ID="03"/>
        <OBJECT ID="04"/>
        <OBJECT ID="05"/>
        <OBJECT ID="06"/>
        <OBJECT ID="07"/>
        <OBJECT ID="08"/>
    </OBJECTS>
    <LINKS>
        <LINK ID="01" O1-ID="01" O2-ID="02"/>
        <LINK ID="02" O1-ID="03" O2-ID="04"/>
        <LINK ID="03" O1-ID="05" O2-ID="06"/>
        <LINK ID="04" O1-ID="07" O2-ID="08"/>
    </LINKS>
    <ATTRIBUTES>
        <ATTRIBUTE NAME="ObjType" ITEM-TYPE="O" DATA-TYPE="STR">
            <ATTR-VALUE ITEM-ID="01">
                  <COL-VALUE>book</COL-VALUE>
            </ATTR-VALUE>
            <ATTR-VALUE ITEM-ID="02">
                  <COL-VALUE>movie</COL-VALUE>
            </ATTR-VALUE>
            <ATTR-VALUE ITEM-ID="03">
                  <COL-VALUE>book</COL-VALUE>
            </ATTR-VALUE>
            <ATTR-VALUE ITEM-ID="04">
                  <COL-VALUE>movie</COL-VALUE>
            </ATTR-VALUE>
            <ATTR-VALUE ITEM-ID="05">
                  <COL-VALUE>book</COL-VALUE>
            </ATTR-VALUE>
            <ATTR-VALUE ITEM-ID="06">
                  <COL-VALUE>movie</COL-VALUE>
            </ATTR-VALUE>
            <ATTR-VALUE ITEM-ID="07">
                  <COL-VALUE>book</COL-VALUE>
            </ATTR-VALUE>
            <ATTR-VALUE ITEM-ID="08">
                  <COL-VALUE>movie</COL-VALUE>
            </ATTR-VALUE>
        </ATTRIBUTE>
        <ATTRIBUTE NAME="Title" ITEM-TYPE="O" DATA-TYPE="STR">
            <ATTR-VALUE ITEM-ID="01">
                  <COL-VALUE>Carrie</COL-VALUE>
            </ATTR-VALUE>
            <ATTR-VALUE ITEM-ID="03">
                  <COL-VALUE>Shakespeare in Love</COL-VALUE>
            </ATTR-VALUE>
            <ATTR-VALUE ITEM-ID="05">
                  <COL-VALUE>A Beautiful Mind</COL-VALUE>
            </ATTR-VALUE>
            <ATTR-VALUE ITEM-ID="07">
                  <COL-VALUE>Bag of Bones</COL-VALUE>
            </ATTR-VALUE>
        </ATTRIBUTE>
        <ATTRIBUTE NAME="Name" ITEM-TYPE="O" DATA-TYPE="STR">
            <ATTR-VALUE ITEM-ID="02">
                  <COL-VALUE>Carrie</COL-VALUE>
            </ATTR-VALUE>
            <ATTR-VALUE ITEM-ID="04">
                  <COL-VALUE>Shakespeare in Love</COL-VALUE>
            </ATTR-VALUE>
            <ATTR-VALUE ITEM-ID="06">
                  <COL-VALUE>A Beautiful Mind</COL-VALUE>
            </ATTR-VALUE>
            <ATTR-VALUE ITEM-ID="08">
                  <COL-VALUE>Bag of Bones</COL-VALUE>
            </ATTR-VALUE>
        </ATTRIBUTE>
        <ATTRIBUTE NAME="PubDate" ITEM-TYPE="O" DATA-TYPE="INT">
            <ATTR-VALUE ITEM-ID="01">
                  <COL-VALUE>1974</COL-VALUE>
            </ATTR-VALUE>
            <ATTR-VALUE ITEM-ID="01">
                  <COL-VALUE>1981</COL-VALUE>
            </ATTR-VALUE>
            <ATTR-VALUE ITEM-ID="01">
                  <COL-VALUE>1993</COL-VALUE>
            </ATTR-VALUE>
            <ATTR-VALUE ITEM-ID="01">
                  <COL-VALUE>2003</COL-VALUE>
            </ATTR-VALUE>
            <ATTR-VALUE ITEM-ID="03">
                  <COL-VALUE>1999</COL-VALUE>
            </ATTR-VALUE>
            <ATTR-VALUE ITEM-ID="05">
                  <COL-VALUE>1998</COL-VALUE>
            </ATTR-VALUE>
            <ATTR-VALUE ITEM-ID="07">
                  <COL-VALUE>1998</COL-VALUE>
            </ATTR-VALUE>
        </ATTRIBUTE>
        <ATTRIBUTE NAME="ReleaseYear" ITEM-TYPE="O" DATA-TYPE="INT">
            <ATTR-VALUE ITEM-ID="02">
                  <COL-VALUE>1976</COL-VALUE>
            </ATTR-VALUE>
            <ATTR-VALUE ITEM-ID="04">
                  <COL-VALUE>1998</COL-VALUE>
            </ATTR-VALUE>
            <ATTR-VALUE ITEM-ID="06">
                  <COL-VALUE>2001</COL-VALUE>
            </ATTR-VALUE>
        </ATTRIBUTE>
    </ATTRIBUTES>
</PROX3DB>
