<?xml version="1.0" encoding="UTF-8"?>

<!-- Part of the open-source Proximity system (see LICENSE for 
     copyright and license information). -->

<!DOCTYPE PROX3DB SYSTEM "prox3db.dtd">
<PROX3DB NAME="Basics_DB04">
    <OBJECTS>
        <OBJECT ID="01"/>
        <OBJECT ID="02"/>
    </OBJECTS>
    <LINKS>
        <LINK ID="01" O1-ID="01" O2-ID="02"/>
        <LINK ID="02" O1-ID="02" O2-ID="02"/>
    </LINKS>
    <ATTRIBUTES>
        <ATTRIBUTE NAME="ObjType" ITEM-TYPE="O" DATA-TYPE="STR">
            <ATTR-VALUE ITEM-ID="01">
                  <COL-VALUE>project-page</COL-VALUE>
            </ATTR-VALUE>
            <ATTR-VALUE ITEM-ID="02">
                  <COL-VALUE>directory-page</COL-VALUE>
            </ATTR-VALUE>
        </ATTRIBUTE>
        <ATTRIBUTE NAME="LinkType" ITEM-TYPE="L" DATA-TYPE="STR">
            <ATTR-VALUE ITEM-ID="01">
                  <COL-VALUE>link</COL-VALUE>
            </ATTR-VALUE>
            <ATTR-VALUE ITEM-ID="02">
                  <COL-VALUE>loop</COL-VALUE>
            </ATTR-VALUE>
        </ATTRIBUTE>
    </ATTRIBUTES>
</PROX3DB>
