<?xml version="1.0" encoding="UTF-8"?>
<!DOCTYPE PROX3DB SYSTEM "prox3db.dtd">
<PROX3DB>
    <CONTAINERS>
        <CONTAINER NAME="b" ID="1">
            <SUBG-ITEMS>
                <ITEM SUBG-ID="0" ITEM-ID="1" ITEM-TYPE="O" NAME="A"/>
                <ITEM SUBG-ID="0" ITEM-ID="1" ITEM-TYPE="L" NAME="X"/>
            </SUBG-ITEMS>
            <SUBG-ATTRIBUTES>
                <SUBG-ATTRIBUTE NAME="attr1" DATA-TYPE="year:int">
                    <ATTR-VALUE ITEM-ID="1">
                        <COL-VALUE>1995</COL-VALUE>
                    </ATTR-VALUE>
                </SUBG-ATTRIBUTE>
            </SUBG-ATTRIBUTES>
        </CONTAINER>
    </CONTAINERS>
</PROX3DB>
