<?xml version="1.0" encoding="UTF-8"?>

<!-- Part of the open-source Proximity system (see LICENSE for 
     copyright and license information). -->

<!DOCTYPE PROX3DB SYSTEM "prox3db.dtd">
<PROX3DB NAME="SubQ_DB02">
    <OBJECTS>
        <OBJECT ID="01"/>
        <OBJECT ID="02"/>
        <OBJECT ID="03"/>
        <OBJECT ID="04"/>
        <OBJECT ID="05"/>
        <OBJECT ID="06"/>
    </OBJECTS>
    <LINKS>
        <LINK ID="01" O1-ID="01" O2-ID="02"/>
        <LINK ID="02" O1-ID="01" O2-ID="03"/>
        <LINK ID="03" O1-ID="03" O2-ID="01"/>
        <LINK ID="04" O1-ID="03" O2-ID="02"/>
        <LINK ID="05" O1-ID="01" O2-ID="04"/>
        <LINK ID="06" O1-ID="04" O2-ID="05"/>
        <LINK ID="07" O1-ID="05" O2-ID="05"/>
        <LINK ID="08" O1-ID="01" O2-ID="06"/>
        <LINK ID="09" O1-ID="06" O2-ID="01"/>
        <LINK ID="10" O1-ID="06" O2-ID="06"/>
    </LINKS>
    <ATTRIBUTES>
        <ATTRIBUTE NAME="PageType" ITEM-TYPE="O" DATA-TYPE="STR">
            <ATTR-VALUE ITEM-ID="01">
                <COL-VALUE>Faculty</COL-VALUE>
            </ATTR-VALUE>
            <ATTR-VALUE ITEM-ID="02">
                <COL-VALUE>Student</COL-VALUE>
            </ATTR-VALUE>
            <ATTR-VALUE ITEM-ID="03">
                <COL-VALUE>Student</COL-VALUE>
            </ATTR-VALUE>
            <ATTR-VALUE ITEM-ID="04">
                <COL-VALUE>Faculty</COL-VALUE>
            </ATTR-VALUE>
            <ATTR-VALUE ITEM-ID="05">
                <COL-VALUE>Student</COL-VALUE>
            </ATTR-VALUE>
            <ATTR-VALUE ITEM-ID="06">
                <COL-VALUE>Student</COL-VALUE>
            </ATTR-VALUE>
        </ATTRIBUTE>
        <ATTRIBUTE NAME="Page" ITEM-TYPE="O" DATA-TYPE="STR">
            <ATTR-VALUE ITEM-ID="01">
                <COL-VALUE>page01.html</COL-VALUE>
            </ATTR-VALUE>
            <ATTR-VALUE ITEM-ID="02">
                <COL-VALUE>page02.html</COL-VALUE>
            </ATTR-VALUE>
            <ATTR-VALUE ITEM-ID="03">
                <COL-VALUE>page03.html</COL-VALUE>
            </ATTR-VALUE>
            <ATTR-VALUE ITEM-ID="04">
                <COL-VALUE>page04.html</COL-VALUE>
            </ATTR-VALUE>
            <ATTR-VALUE ITEM-ID="05">
                <COL-VALUE>page05.html</COL-VALUE>
            </ATTR-VALUE>
            <ATTR-VALUE ITEM-ID="06">
                <COL-VALUE>page06.html</COL-VALUE>
            </ATTR-VALUE>
        </ATTRIBUTE>
    </ATTRIBUTES>
</PROX3DB>
