<?xml version="1.0" encoding="UTF-8"?>

<!-- Part of the open-source Proximity system (see LICENSE for 
     copyright and license information). -->

<!DOCTYPE PROX3DB SYSTEM "prox3db.dtd">
<PROX3DB NAME="Const_DB02">
    <OBJECTS>
        <OBJECT ID="01"/>
        <OBJECT ID="02"/>
        <OBJECT ID="03"/>
    </OBJECTS>
    <LINKS>
        <LINK ID="01" O1-ID="02" O2-ID="01"/>
        <LINK ID="02" O1-ID="02" O2-ID="03"/>
    </LINKS>
    <ATTRIBUTES>
        <ATTRIBUTE NAME="ObjType" ITEM-TYPE="O" DATA-TYPE="STR">
            <ATTR-VALUE ITEM-ID="01">
                <COL-VALUE>person</COL-VALUE>
            </ATTR-VALUE>
            <ATTR-VALUE ITEM-ID="02">
                <COL-VALUE>person</COL-VALUE>
            </ATTR-VALUE>
            <ATTR-VALUE ITEM-ID="03">
                <COL-VALUE>person</COL-VALUE>
            </ATTR-VALUE>
        </ATTRIBUTE>
        <ATTRIBUTE NAME="Name" ITEM-TYPE="O" DATA-TYPE="STR">
            <ATTR-VALUE ITEM-ID="01">
                <COL-VALUE>Tony Curtis</COL-VALUE>
            </ATTR-VALUE>
            <ATTR-VALUE ITEM-ID="02">
                <COL-VALUE>Jamie Lee Curtis</COL-VALUE>
            </ATTR-VALUE>
            <ATTR-VALUE ITEM-ID="03">
                <COL-VALUE>Janet Leigh</COL-VALUE>
            </ATTR-VALUE>
        </ATTRIBUTE>
        <ATTRIBUTE NAME="LinkType" ITEM-TYPE="L" DATA-TYPE="STR">
            <ATTR-VALUE ITEM-ID="01">
                <COL-VALUE>has-parent</COL-VALUE>
            </ATTR-VALUE>
            <ATTR-VALUE ITEM-ID="02">
                <COL-VALUE>has-parent</COL-VALUE>
            </ATTR-VALUE>
        </ATTRIBUTE>
    </ATTRIBUTES>
</PROX3DB>
