<?xml version="1.0" encoding="UTF-8"?>

<!-- Part of the open-source Proximity system (see LICENSE for 
     copyright and license information). -->

<!DOCTYPE PROX3DB SYSTEM "prox3db.dtd">
<PROX3DB NAME="Annot_DB01">
    <OBJECTS>
        <OBJECT ID="01"/>
        <OBJECT ID="02"/>
        <OBJECT ID="03"/>
        <OBJECT ID="04"/>
        <OBJECT ID="05"/>
        <OBJECT ID="06"/>
        <OBJECT ID="07"/>
        <OBJECT ID="08"/>
        <OBJECT ID="09"/>
        <OBJECT ID="10"/>
    </OBJECTS>
    <LINKS>
        <LINK ID="01" O1-ID="02" O2-ID="01"/>
        <LINK ID="02" O1-ID="03" O2-ID="01"/>
        <LINK ID="03" O1-ID="04" O2-ID="01"/>
        <LINK ID="04" O1-ID="05" O2-ID="01"/>
        <LINK ID="05" O1-ID="06" O2-ID="02"/>
        <LINK ID="06" O1-ID="06" O2-ID="04"/>
        <LINK ID="07" O1-ID="07" O2-ID="04"/>
        <LINK ID="08" O1-ID="08" O2-ID="03"/>
        <LINK ID="09" O1-ID="08" O2-ID="05"/>
        <LINK ID="10" O1-ID="09" O2-ID="05"/>
        <LINK ID="11" O1-ID="10" O2-ID="05"/>
    </LINKS>
    <ATTRIBUTES>
        <ATTRIBUTE NAME="ObjType" ITEM-TYPE="O" DATA-TYPE="STR">
            <ATTR-VALUE ITEM-ID="01">
                <COL-VALUE>Academy Award</COL-VALUE>
            </ATTR-VALUE>
            <ATTR-VALUE ITEM-ID="02">
                <COL-VALUE>Movie</COL-VALUE>
            </ATTR-VALUE>
            <ATTR-VALUE ITEM-ID="03">
                <COL-VALUE>Movie</COL-VALUE>
            </ATTR-VALUE>
            <ATTR-VALUE ITEM-ID="04">
                <COL-VALUE>Movie</COL-VALUE>
            </ATTR-VALUE>
            <ATTR-VALUE ITEM-ID="05">
                <COL-VALUE>Movie</COL-VALUE>
            </ATTR-VALUE>
            <ATTR-VALUE ITEM-ID="06">
                <COL-VALUE>Studio</COL-VALUE>
            </ATTR-VALUE>
            <ATTR-VALUE ITEM-ID="07">
                <COL-VALUE>Studio</COL-VALUE>
            </ATTR-VALUE>
            <ATTR-VALUE ITEM-ID="08">
                <COL-VALUE>Studio</COL-VALUE>
            </ATTR-VALUE>
            <ATTR-VALUE ITEM-ID="09">
                <COL-VALUE>Studio</COL-VALUE>
            </ATTR-VALUE>
            <ATTR-VALUE ITEM-ID="10">
                <COL-VALUE>Studio</COL-VALUE>
            </ATTR-VALUE>
        </ATTRIBUTE>
        <ATTRIBUTE NAME="AwardName" ITEM-TYPE="O" DATA-TYPE="STR">
            <ATTR-VALUE ITEM-ID="01">
                <COL-VALUE>Best Picture</COL-VALUE>
            </ATTR-VALUE>
        </ATTRIBUTE>
        <ATTRIBUTE NAME="Title" ITEM-TYPE="O" DATA-TYPE="STR">
            <ATTR-VALUE ITEM-ID="02">
                <COL-VALUE>Forrest Gump</COL-VALUE>
            </ATTR-VALUE>
            <ATTR-VALUE ITEM-ID="03">
                <COL-VALUE>Chicago</COL-VALUE>
            </ATTR-VALUE>
            <ATTR-VALUE ITEM-ID="04">
                <COL-VALUE>Titanic</COL-VALUE>
            </ATTR-VALUE>
            <ATTR-VALUE ITEM-ID="05">
                <COL-VALUE>Shakespeare in Love</COL-VALUE>
            </ATTR-VALUE>
        </ATTRIBUTE>
        <ATTRIBUTE NAME="Name" ITEM-TYPE="O" DATA-TYPE="STR">
            <ATTR-VALUE ITEM-ID="06">
                <COL-VALUE>Paramount</COL-VALUE>
            </ATTR-VALUE>
            <ATTR-VALUE ITEM-ID="07">
                <COL-VALUE>20th Century Fox</COL-VALUE>
            </ATTR-VALUE>
            <ATTR-VALUE ITEM-ID="08">
                <COL-VALUE>Miramax</COL-VALUE>
            </ATTR-VALUE>
            <ATTR-VALUE ITEM-ID="09">
                <COL-VALUE>Universal</COL-VALUE>
            </ATTR-VALUE>
            <ATTR-VALUE ITEM-ID="10">
                <COL-VALUE>Bedford Falls Productions</COL-VALUE>
            </ATTR-VALUE>
        </ATTRIBUTE>
        <ATTRIBUTE NAME="LinkType" ITEM-TYPE="L" DATA-TYPE="STR">
            <ATTR-VALUE ITEM-ID="01">
                <COL-VALUE>won-award</COL-VALUE>
            </ATTR-VALUE>
            <ATTR-VALUE ITEM-ID="02">
                <COL-VALUE>won-award</COL-VALUE>
            </ATTR-VALUE>
            <ATTR-VALUE ITEM-ID="03">
                <COL-VALUE>won-award</COL-VALUE>
            </ATTR-VALUE>
            <ATTR-VALUE ITEM-ID="04">
                <COL-VALUE>won-award</COL-VALUE>
            </ATTR-VALUE>
            <ATTR-VALUE ITEM-ID="05">
                <COL-VALUE>produced</COL-VALUE>
            </ATTR-VALUE>
            <ATTR-VALUE ITEM-ID="06">
                <COL-VALUE>produced</COL-VALUE>
            </ATTR-VALUE>
            <ATTR-VALUE ITEM-ID="07">
                <COL-VALUE>produced</COL-VALUE>
            </ATTR-VALUE>
            <ATTR-VALUE ITEM-ID="08">
                <COL-VALUE>produced</COL-VALUE>
            </ATTR-VALUE>
            <ATTR-VALUE ITEM-ID="09">
                <COL-VALUE>produced</COL-VALUE>
            </ATTR-VALUE>
            <ATTR-VALUE ITEM-ID="10">
                <COL-VALUE>produced</COL-VALUE>
            </ATTR-VALUE>
            <ATTR-VALUE ITEM-ID="11">
                <COL-VALUE>produced</COL-VALUE>
            </ATTR-VALUE>
        </ATTRIBUTE>
    </ATTRIBUTES>
</PROX3DB>
