<?xml version="1.0" encoding="UTF-8"?>

<!-- Part of the open-source Proximity system (see LICENSE for 
     copyright and license information). -->

<!DOCTYPE PROX3DB SYSTEM "prox3db.dtd">
<PROX3DB>
    <ATTRIBUTES>
        <ATTRIBUTE NAME="link_tag" ITEM-TYPE="L" DATA-TYPE="str">
            <ATTR-VALUE ITEM-ID="1">
                <COL-VALUE>NEW-VALUE</COL-VALUE>
            </ATTR-VALUE>
            <ATTR-VALUE ITEM-ID="2">
                <COL-VALUE>NEW-VALUE</COL-VALUE>
            </ATTR-VALUE>
            <ATTR-VALUE ITEM-ID="3">
                <COL-VALUE>NEW-VALUE</COL-VALUE>
            </ATTR-VALUE>
            <ATTR-VALUE ITEM-ID="4">
                <COL-VALUE>NEW-VALUE</COL-VALUE>
            </ATTR-VALUE>
            <ATTR-VALUE ITEM-ID="5">
                <COL-VALUE>NEW-VALUE</COL-VALUE>
            </ATTR-VALUE>
        </ATTRIBUTE>
    </ATTRIBUTES>
</PROX3DB>
