<?xml version="1.0" encoding="UTF-8"?>

<!-- Part of the open-source Proximity system (see LICENSE for 
     copyright and license information). -->

<!DOCTYPE PROX3DB SYSTEM "prox3db.dtd">
<PROX3DB NAME="Annot_DB06">
    <OBJECTS>
        <OBJECT ID="01"/>
        <OBJECT ID="02"/>
        <OBJECT ID="03"/>
    </OBJECTS>
    <LINKS>
        <LINK ID="01" O1-ID="01" O2-ID="02"/>
        <LINK ID="02" O1-ID="01" O2-ID="03"/>
        <LINK ID="03" O1-ID="01" O2-ID="03"/>
        <LINK ID="04" O1-ID="01" O2-ID="03"/>
    </LINKS>
    <ATTRIBUTES>
        <ATTRIBUTE NAME="ObjType" ITEM-TYPE="O" DATA-TYPE="STR">
            <ATTR-VALUE ITEM-ID="01">
                <COL-VALUE>person</COL-VALUE>
            </ATTR-VALUE>
            <ATTR-VALUE ITEM-ID="02">
                <COL-VALUE>movie</COL-VALUE>
            </ATTR-VALUE>
            <ATTR-VALUE ITEM-ID="03">
                <COL-VALUE>movie</COL-VALUE>
            </ATTR-VALUE>
        </ATTRIBUTE>
        <ATTRIBUTE NAME="Name" ITEM-TYPE="O" DATA-TYPE="STR">
            <ATTR-VALUE ITEM-ID="01">
                <COL-VALUE>Alec Guiness</COL-VALUE>
            </ATTR-VALUE>
        </ATTRIBUTE>
        <ATTRIBUTE NAME="Title" ITEM-TYPE="O" DATA-TYPE="STR">
            <ATTR-VALUE ITEM-ID="02">
                <COL-VALUE>The Ladykillers</COL-VALUE>
            </ATTR-VALUE>
            <ATTR-VALUE ITEM-ID="03">
                <COL-VALUE>Kind Hearts and Coronets</COL-VALUE>
            </ATTR-VALUE>
        </ATTRIBUTE>
        <ATTRIBUTE NAME="Role" ITEM-TYPE="L" DATA-TYPE="STR">
            <ATTR-VALUE ITEM-ID="01">
                <COL-VALUE>Professor Marcus</COL-VALUE>
            </ATTR-VALUE>
            <ATTR-VALUE ITEM-ID="02">
                <COL-VALUE>Lady Agatha</COL-VALUE>
            </ATTR-VALUE>
            <ATTR-VALUE ITEM-ID="03">
                <COL-VALUE>The Duke</COL-VALUE>
            </ATTR-VALUE>
            <ATTR-VALUE ITEM-ID="04">
                <COL-VALUE>Young Ascoyne</COL-VALUE>
            </ATTR-VALUE>
        </ATTRIBUTE>
    </ATTRIBUTES>
</PROX3DB>
