<?xml version="1.0" encoding="UTF-8"?>

<!-- Part of the open-source Proximity system (see LICENSE for 
     copyright and license information). -->

<!DOCTYPE PROX3DB SYSTEM "prox3db.dtd">
<PROX3DB NAME="DBManip_ShortcutLinks_DB">
    <OBJECTS>
        <OBJECT ID="30"/>
        <OBJECT ID="40"/>
        <OBJECT ID="50"/>
        <OBJECT ID="300"/>
        <OBJECT ID="400"/>
    </OBJECTS>
    <LINKS>
        <LINK ID="01" O1-ID="30" O2-ID="300"/>
        <LINK ID="02" O1-ID="40" O2-ID="300"/>
        <LINK ID="03" O1-ID="30" O2-ID="400"/>
        <LINK ID="04" O1-ID="40" O2-ID="400"/>
        <LINK ID="05" O1-ID="50" O2-ID="400"/>
    </LINKS>
    <ATTRIBUTES>
        <ATTRIBUTE NAME="object_type" ITEM-TYPE="O" DATA-TYPE="STR">
            <ATTR-VALUE ITEM-ID="30">
                  <COL-VALUE>Actor</COL-VALUE>
            </ATTR-VALUE>
            <ATTR-VALUE ITEM-ID="40">
                  <COL-VALUE>Actor</COL-VALUE>
            </ATTR-VALUE>
            <ATTR-VALUE ITEM-ID="50">
                  <COL-VALUE>Actor</COL-VALUE>
            </ATTR-VALUE>
            <ATTR-VALUE ITEM-ID="300">
                  <COL-VALUE>Movie</COL-VALUE>
            </ATTR-VALUE>
            <ATTR-VALUE ITEM-ID="400">
                  <COL-VALUE>Movie</COL-VALUE>
            </ATTR-VALUE>
        </ATTRIBUTE>
        <ATTRIBUTE NAME="name" ITEM-TYPE="O" DATA-TYPE="STR">
            <ATTR-VALUE ITEM-ID="30">
                  <COL-VALUE>Al Pacino</COL-VALUE>
            </ATTR-VALUE>
            <ATTR-VALUE ITEM-ID="40">
                  <COL-VALUE>John Cazale</COL-VALUE>
            </ATTR-VALUE>
            <ATTR-VALUE ITEM-ID="50">
                  <COL-VALUE>Marlon Brando</COL-VALUE>
            </ATTR-VALUE>
        </ATTRIBUTE>
        <ATTRIBUTE NAME="title" ITEM-TYPE="O" DATA-TYPE="STR">
            <ATTR-VALUE ITEM-ID="300">
                  <COL-VALUE>Dog Day Afternoon</COL-VALUE>
            </ATTR-VALUE>
            <ATTR-VALUE ITEM-ID="400">
                  <COL-VALUE>The Godfather</COL-VALUE>
            </ATTR-VALUE>
        </ATTRIBUTE>
        <ATTRIBUTE NAME="link_type" ITEM-TYPE="L" DATA-TYPE="STR">
            <ATTR-VALUE ITEM-ID="1">
                  <COL-VALUE>ActedIn</COL-VALUE>
            </ATTR-VALUE>
            <ATTR-VALUE ITEM-ID="2">
                  <COL-VALUE>ActedIn</COL-VALUE>
            </ATTR-VALUE>
            <ATTR-VALUE ITEM-ID="3">
                  <COL-VALUE>ActedIn</COL-VALUE>
            </ATTR-VALUE>
            <ATTR-VALUE ITEM-ID="4">
                  <COL-VALUE>ActedIn</COL-VALUE>
            </ATTR-VALUE>
            <ATTR-VALUE ITEM-ID="5">
                  <COL-VALUE>ActedIn</COL-VALUE>
            </ATTR-VALUE>
        </ATTRIBUTE>
    </ATTRIBUTES>
</PROX3DB>
