<?xml version="1.0" encoding="UTF-8"?>

<!-- Part of the open-source Proximity system (see LICENSE for 
     copyright and license information). -->

<!DOCTYPE PROX3DB SYSTEM "prox3db.dtd">
<PROX3DB NAME="Annot_DB02">
    <OBJECTS>
        <OBJECT ID="01"/>
        <OBJECT ID="02"/>
        <OBJECT ID="03"/>
        <OBJECT ID="04"/>
    </OBJECTS>
    <LINKS>
        <LINK ID="01" O1-ID="02" O2-ID="01"/>
        <LINK ID="02" O1-ID="02" O2-ID="01"/>
        <LINK ID="03" O1-ID="02" O2-ID="01"/>
        <LINK ID="04" O1-ID="02" O2-ID="01"/>
        <LINK ID="05" O1-ID="03" O2-ID="01"/>
        <LINK ID="06" O1-ID="03" O2-ID="01"/>
        <LINK ID="07" O1-ID="04" O2-ID="01"/>
    </LINKS>
    <ATTRIBUTES>
        <ATTRIBUTE NAME="ObjType" ITEM-TYPE="O" DATA-TYPE="STR">
            <ATTR-VALUE ITEM-ID="01">
                <COL-VALUE>Movie</COL-VALUE>
            </ATTR-VALUE>
            <ATTR-VALUE ITEM-ID="02">
                <COL-VALUE>Actor</COL-VALUE>
            </ATTR-VALUE>
            <ATTR-VALUE ITEM-ID="03">
                <COL-VALUE>Actor</COL-VALUE>
            </ATTR-VALUE>
            <ATTR-VALUE ITEM-ID="04">
                <COL-VALUE>Actor</COL-VALUE>
            </ATTR-VALUE>
        </ATTRIBUTE>
        <ATTRIBUTE NAME="Title" ITEM-TYPE="O" DATA-TYPE="STR">
            <ATTR-VALUE ITEM-ID="01">
                <COL-VALUE>Angels in America</COL-VALUE>
            </ATTR-VALUE>
        </ATTRIBUTE>
        <ATTRIBUTE NAME="Name" ITEM-TYPE="O" DATA-TYPE="STR">
            <ATTR-VALUE ITEM-ID="02">
                <COL-VALUE>Meryl Streep</COL-VALUE>
            </ATTR-VALUE>
            <ATTR-VALUE ITEM-ID="03">
                <COL-VALUE>Justin Kirk</COL-VALUE>
            </ATTR-VALUE>
            <ATTR-VALUE ITEM-ID="04">
                <COL-VALUE>Al Pacino</COL-VALUE>
            </ATTR-VALUE>
        </ATTRIBUTE>
        <ATTRIBUTE NAME="Role" ITEM-TYPE="L" DATA-TYPE="STR">
            <ATTR-VALUE ITEM-ID="01">
                <COL-VALUE>Ethel Rosenberg</COL-VALUE>
            </ATTR-VALUE>
            <ATTR-VALUE ITEM-ID="02">
                <COL-VALUE>Hannah Pitt</COL-VALUE>
            </ATTR-VALUE>
            <ATTR-VALUE ITEM-ID="03">
                <COL-VALUE>The Rabbi</COL-VALUE>
            </ATTR-VALUE>
            <ATTR-VALUE ITEM-ID="04">
                <COL-VALUE>The Angel Australia</COL-VALUE>
            </ATTR-VALUE>
            <ATTR-VALUE ITEM-ID="05">
                <COL-VALUE>The Man in the Park</COL-VALUE>
            </ATTR-VALUE>
            <ATTR-VALUE ITEM-ID="06">
                <COL-VALUE>Prior Walter</COL-VALUE>
            </ATTR-VALUE>
            <ATTR-VALUE ITEM-ID="07">
                <COL-VALUE>Roy Cohn</COL-VALUE>
            </ATTR-VALUE>
        </ATTRIBUTE>
    </ATTRIBUTES>
</PROX3DB>
