<?xml version="1.0" encoding="UTF-8"?>

<!-- Part of the open-source Proximity system (see LICENSE for 
     copyright and license information). -->

<!DOCTYPE PROX3DB SYSTEM "prox3db.dtd">
<PROX3DB NAME="Annot_DB03">
    <OBJECTS>
        <OBJECT ID="01"/>
        <OBJECT ID="02"/>
        <OBJECT ID="03"/>
        <OBJECT ID="04"/>
        <OBJECT ID="05"/>
        <OBJECT ID="06"/>
        <OBJECT ID="07"/>
        <OBJECT ID="08"/>
        <OBJECT ID="09"/>
    </OBJECTS>
    <LINKS>
        <LINK ID="01" O1-ID="01" O2-ID="03"/>
        <LINK ID="02" O1-ID="01" O2-ID="03"/>
        <LINK ID="03" O1-ID="01" O2-ID="04"/>
        <LINK ID="04" O1-ID="01" O2-ID="05"/>
        <LINK ID="05" O1-ID="01" O2-ID="05"/>
        <LINK ID="06" O1-ID="01" O2-ID="06"/>
        <LINK ID="07" O1-ID="02" O2-ID="06"/>
        <LINK ID="08" O1-ID="02" O2-ID="07"/>
        <LINK ID="09" O1-ID="02" O2-ID="07"/>
        <LINK ID="10" O1-ID="02" O2-ID="07"/>
        <LINK ID="11" O1-ID="08" O2-ID="07"/>
        <LINK ID="12" O1-ID="08" O2-ID="07"/>
        <LINK ID="13" O1-ID="09" O2-ID="03"/>
    </LINKS>
    <ATTRIBUTES>
        <ATTRIBUTE NAME="ObjType" ITEM-TYPE="O" DATA-TYPE="STR">
            <ATTR-VALUE ITEM-ID="01">
                <COL-VALUE>person</COL-VALUE>
            </ATTR-VALUE>
            <ATTR-VALUE ITEM-ID="02">
                <COL-VALUE>person</COL-VALUE>
            </ATTR-VALUE>
            <ATTR-VALUE ITEM-ID="03">
                <COL-VALUE>movie</COL-VALUE>
            </ATTR-VALUE>
            <ATTR-VALUE ITEM-ID="04">
                <COL-VALUE>movie</COL-VALUE>
            </ATTR-VALUE>
            <ATTR-VALUE ITEM-ID="05">
                <COL-VALUE>movie</COL-VALUE>
            </ATTR-VALUE>
            <ATTR-VALUE ITEM-ID="06">
                <COL-VALUE>movie</COL-VALUE>
            </ATTR-VALUE>
            <ATTR-VALUE ITEM-ID="07">
                <COL-VALUE>movie</COL-VALUE>
            </ATTR-VALUE>
            <ATTR-VALUE ITEM-ID="08">
                <COL-VALUE>person</COL-VALUE>
            </ATTR-VALUE>
            <ATTR-VALUE ITEM-ID="09">
                <COL-VALUE>person</COL-VALUE>
            </ATTR-VALUE>
        </ATTRIBUTE>
        <ATTRIBUTE NAME="Name" ITEM-TYPE="O" DATA-TYPE="STR">
            <ATTR-VALUE ITEM-ID="01">
                <COL-VALUE>Peter Sellers</COL-VALUE>
            </ATTR-VALUE>
            <ATTR-VALUE ITEM-ID="02">
                <COL-VALUE>Alec Guiness</COL-VALUE>
            </ATTR-VALUE>
            <ATTR-VALUE ITEM-ID="08">
                <COL-VALUE>Dennis Price</COL-VALUE>
            </ATTR-VALUE>
            <ATTR-VALUE ITEM-ID="09">
                <COL-VALUE>George C. Scott</COL-VALUE>
            </ATTR-VALUE>
        </ATTRIBUTE>
        <ATTRIBUTE NAME="Title" ITEM-TYPE="O" DATA-TYPE="STR">
            <ATTR-VALUE ITEM-ID="03">
                <COL-VALUE>Dr. Strangelove</COL-VALUE>
            </ATTR-VALUE>
            <ATTR-VALUE ITEM-ID="04">
                <COL-VALUE>The Pink Panther</COL-VALUE>
            </ATTR-VALUE>
            <ATTR-VALUE ITEM-ID="05">
                <COL-VALUE>The Mouse That Roared</COL-VALUE>
            </ATTR-VALUE>
            <ATTR-VALUE ITEM-ID="06">
                <COL-VALUE>The Ladykillers</COL-VALUE>
            </ATTR-VALUE>
            <ATTR-VALUE ITEM-ID="07">
                <COL-VALUE>Kind Hearts and Coronets</COL-VALUE>
            </ATTR-VALUE>
        </ATTRIBUTE>
        <ATTRIBUTE NAME="Role" ITEM-TYPE="L" DATA-TYPE="STR">
            <ATTR-VALUE ITEM-ID="01">
                <COL-VALUE>Dr. Strangelove</COL-VALUE>
            </ATTR-VALUE>
            <ATTR-VALUE ITEM-ID="02">
                <COL-VALUE>President Muffley</COL-VALUE>
            </ATTR-VALUE>
            <ATTR-VALUE ITEM-ID="03">
                <COL-VALUE>Inspector Clousseau</COL-VALUE>
            </ATTR-VALUE>
            <ATTR-VALUE ITEM-ID="04">
                <COL-VALUE>Grand Duchess Gloriana</COL-VALUE>
            </ATTR-VALUE>
            <ATTR-VALUE ITEM-ID="05">
                <COL-VALUE>Tully Bascombe</COL-VALUE>
            </ATTR-VALUE>
            <ATTR-VALUE ITEM-ID="06">
                <COL-VALUE>Harry</COL-VALUE>
            </ATTR-VALUE>
            <ATTR-VALUE ITEM-ID="07">
                <COL-VALUE>Professor Marcus</COL-VALUE>
            </ATTR-VALUE>
            <ATTR-VALUE ITEM-ID="08">
                <COL-VALUE>Lady Agatha</COL-VALUE>
            </ATTR-VALUE>
            <ATTR-VALUE ITEM-ID="09">
                <COL-VALUE>The Duke</COL-VALUE>
            </ATTR-VALUE>
            <ATTR-VALUE ITEM-ID="10">
                <COL-VALUE>Young Ascoyne</COL-VALUE>
            </ATTR-VALUE>
            <ATTR-VALUE ITEM-ID="11">
                <COL-VALUE>Duke Louis Mazzini</COL-VALUE>
            </ATTR-VALUE>
            <ATTR-VALUE ITEM-ID="12">
                <COL-VALUE>Mazzini, Sr.</COL-VALUE>
            </ATTR-VALUE>
            <ATTR-VALUE ITEM-ID="13">
                <COL-VALUE>Gen. Buck Turgidson</COL-VALUE>
            </ATTR-VALUE>
        </ATTRIBUTE>
    </ATTRIBUTES>
</PROX3DB>
