<?xml version="1.0" encoding="UTF-8"?>

<!-- Part of the open-source Proximity system (see LICENSE for 
     copyright and license information). -->

<!DOCTYPE PROX3DB SYSTEM "prox3db.dtd">
<PROX3DB NAME="SubQ_DB03">
    <OBJECTS>
        <OBJECT ID="01"/>
        <OBJECT ID="02"/>
        <OBJECT ID="03"/>
        <OBJECT ID="04"/>
        <OBJECT ID="05"/>
        <OBJECT ID="06"/>
        <OBJECT ID="07"/>
        <OBJECT ID="08"/>
        <OBJECT ID="09"/>
    </OBJECTS>
    <LINKS>
        <LINK ID="01" O1-ID="01" O2-ID="02"/>
        <LINK ID="02" O1-ID="02" O2-ID="01"/>
        <LINK ID="03" O1-ID="01" O2-ID="03"/>
        <LINK ID="04" O1-ID="03" O2-ID="01"/>
        <LINK ID="05" O1-ID="03" O2-ID="04"/>
        <LINK ID="06" O1-ID="04" O2-ID="03"/>
        <LINK ID="07" O1-ID="03" O2-ID="05"/>
        <LINK ID="08" O1-ID="05" O2-ID="03"/>
        <LINK ID="09" O1-ID="01" O2-ID="06"/>
        <LINK ID="10" O1-ID="06" O2-ID="01"/>
        <LINK ID="11" O1-ID="06" O2-ID="07"/>
        <LINK ID="12" O1-ID="07" O2-ID="06"/>
        <LINK ID="13" O1-ID="06" O2-ID="08"/>
        <LINK ID="14" O1-ID="08" O2-ID="06"/>
        <LINK ID="15" O1-ID="08" O2-ID="09"/>
        <LINK ID="16" O1-ID="09" O2-ID="08"/>
    </LINKS>
    <ATTRIBUTES>
        <ATTRIBUTE NAME="Name" ITEM-TYPE="O" DATA-TYPE="STR">
            <ATTR-VALUE ITEM-ID="01">
                <COL-VALUE>Kevin Bacon</COL-VALUE>
            </ATTR-VALUE>
            <ATTR-VALUE ITEM-ID="02">
                <COL-VALUE>Sean Penn</COL-VALUE>
            </ATTR-VALUE>
            <ATTR-VALUE ITEM-ID="03">
                <COL-VALUE>Jack Nicholson</COL-VALUE>
            </ATTR-VALUE>
            <ATTR-VALUE ITEM-ID="04">
                <COL-VALUE>Pierce Brosnan</COL-VALUE>
            </ATTR-VALUE>
            <ATTR-VALUE ITEM-ID="05">
                <COL-VALUE>Connie Ray</COL-VALUE>
            </ATTR-VALUE>
            <ATTR-VALUE ITEM-ID="06">
                <COL-VALUE>Tom Hanks</COL-VALUE>
            </ATTR-VALUE>
            <ATTR-VALUE ITEM-ID="07">
                <COL-VALUE>Michael Clarke Duncan</COL-VALUE>
            </ATTR-VALUE>
            <ATTR-VALUE ITEM-ID="08">
                <COL-VALUE>Denzel Washington</COL-VALUE>
            </ATTR-VALUE>
            <ATTR-VALUE ITEM-ID="09">
                <COL-VALUE>Cissy Houston</COL-VALUE>
            </ATTR-VALUE>
        </ATTRIBUTE>
    </ATTRIBUTES>
</PROX3DB>
