<?xml version="1.0" encoding="UTF-8"?>
<!DOCTYPE PROX3DB SYSTEM "prox3db.dtd">
<PROX3DB>
    <ATTRIBUTES>
        <ATTRIBUTE NAME="attr1" ITEM-TYPE="O" DATA-TYPE="year:int,gross:int">
            <ATTR-VALUE ITEM-ID="1">
                <COL-VALUE>1995</COL-VALUE>
                <COL-VALUE>1000</COL-VALUE>
            </ATTR-VALUE>
            <ATTR-VALUE ITEM-ID="2">
                <COL-VALUE>1996</COL-VALUE>
                <COL-VALUE>100</COL-VALUE>
            </ATTR-VALUE>
        </ATTRIBUTE>
    </ATTRIBUTES>
</PROX3DB>
