<?xml version="1.0" encoding="UTF-8"?>

<!-- Part of the open-source Proximity system (see LICENSE for 
     copyright and license information). -->

<!DOCTYPE PROX3DB SYSTEM "prox3db.dtd">
<PROX3DB NAME="DBManip_AttrsFromData_DB">
    <OBJECTS>
        <OBJECT ID="01"/>
        <OBJECT ID="02"/>
        <OBJECT ID="03"/>
        <OBJECT ID="04"/>
        <OBJECT ID="05"/>
        <OBJECT ID="06"/>
        <OBJECT ID="07"/>
        <OBJECT ID="08"/>
        <OBJECT ID="09"/>
    </OBJECTS>
    <LINKS>
        <LINK ID="01" O1-ID="03" O2-ID="01"/>
        <LINK ID="02" O1-ID="03" O2-ID="02"/>
        <LINK ID="03" O1-ID="04" O2-ID="01"/>
        <LINK ID="04" O1-ID="05" O2-ID="02"/>
        <LINK ID="05" O1-ID="07" O2-ID="06"/>
        <LINK ID="06" O1-ID="08" O2-ID="06"/>
        <LINK ID="07" O1-ID="09" O2-ID="06"/>
    </LINKS>
    <ATTRIBUTES>
        <ATTRIBUTE NAME="obj_type" ITEM-TYPE="O" DATA-TYPE="STR">
            <ATTR-VALUE ITEM-ID="01">
                  <COL-VALUE>Movie</COL-VALUE>
            </ATTR-VALUE>
            <ATTR-VALUE ITEM-ID="02">
                  <COL-VALUE>Movie</COL-VALUE>
            </ATTR-VALUE>
            <ATTR-VALUE ITEM-ID="03">
                  <COL-VALUE>Studio</COL-VALUE>
            </ATTR-VALUE>
            <ATTR-VALUE ITEM-ID="04">
                  <COL-VALUE>Actor</COL-VALUE>
            </ATTR-VALUE>
            <ATTR-VALUE ITEM-ID="05">
                  <COL-VALUE>Actor</COL-VALUE>
            </ATTR-VALUE>
            <ATTR-VALUE ITEM-ID="06">
                  <COL-VALUE>Movie</COL-VALUE>
            </ATTR-VALUE>
            <ATTR-VALUE ITEM-ID="07">
                  <COL-VALUE>Studio</COL-VALUE>
            </ATTR-VALUE>
            <ATTR-VALUE ITEM-ID="08">
                  <COL-VALUE>Director</COL-VALUE>
            </ATTR-VALUE>
            <ATTR-VALUE ITEM-ID="09">
                  <COL-VALUE>Actor</COL-VALUE>
            </ATTR-VALUE>
        </ATTRIBUTE>
        <ATTRIBUTE NAME="name" ITEM-TYPE="O" DATA-TYPE="STR">
            <ATTR-VALUE ITEM-ID="01">
                  <COL-VALUE>Donnie Darko</COL-VALUE>
            </ATTR-VALUE>
            <ATTR-VALUE ITEM-ID="02">
                  <COL-VALUE>I Heart Huckabees</COL-VALUE>
            </ATTR-VALUE>
            <ATTR-VALUE ITEM-ID="03">
                  <COL-VALUE>20th Century Fox</COL-VALUE>
            </ATTR-VALUE>
            <ATTR-VALUE ITEM-ID="04">
                  <COL-VALUE>Jake Gyllenhaal</COL-VALUE>
            </ATTR-VALUE>
            <ATTR-VALUE ITEM-ID="05">
                  <COL-VALUE>Lily Tomlin</COL-VALUE>
            </ATTR-VALUE>
            <ATTR-VALUE ITEM-ID="06">
                  <COL-VALUE>Princess Bride</COL-VALUE>
            </ATTR-VALUE>
            <ATTR-VALUE ITEM-ID="07">
                  <COL-VALUE>MGM</COL-VALUE>
            </ATTR-VALUE>
            <ATTR-VALUE ITEM-ID="08">
                  <COL-VALUE>Rob Reiner</COL-VALUE>
            </ATTR-VALUE>
            <ATTR-VALUE ITEM-ID="09">
                  <COL-VALUE>Peter Falk</COL-VALUE>
            </ATTR-VALUE>
        </ATTRIBUTE>
        <ATTRIBUTE NAME="link_type" ITEM-TYPE="L" DATA-TYPE="STR">
            <ATTR-VALUE ITEM-ID="01">
                  <COL-VALUE>Produced</COL-VALUE>
            </ATTR-VALUE>
            <ATTR-VALUE ITEM-ID="02">
                  <COL-VALUE>Produced</COL-VALUE>
            </ATTR-VALUE>
            <ATTR-VALUE ITEM-ID="03">
                  <COL-VALUE>ActedIn</COL-VALUE>
            </ATTR-VALUE>
            <ATTR-VALUE ITEM-ID="04">
                  <COL-VALUE>ActedIn</COL-VALUE>
            </ATTR-VALUE>
            <ATTR-VALUE ITEM-ID="05">
                  <COL-VALUE>Produced</COL-VALUE>
            </ATTR-VALUE>
            <ATTR-VALUE ITEM-ID="06">
                  <COL-VALUE>Directed</COL-VALUE>
            </ATTR-VALUE>
            <ATTR-VALUE ITEM-ID="07">
                  <COL-VALUE>ActedIn</COL-VALUE>
            </ATTR-VALUE>
        </ATTRIBUTE>
    </ATTRIBUTES>
</PROX3DB>
