<?xml version="1.0" encoding="UTF-8"?>

<!-- Part of the open-source Proximity system (see LICENSE for 
     copyright and license information). -->

<!DOCTYPE PROX3DB SYSTEM "prox3db.dtd">
<PROX3DB NAME="DBManip_Aggregation_DB">
    <OBJECTS>
        <OBJECT ID="01"/>
        <OBJECT ID="02"/>
        <OBJECT ID="03"/>
    </OBJECTS>
    <LINKS>
        <LINK ID="01" O1-ID="01" O2-ID="02"/>
        <LINK ID="02" O1-ID="02" O2-ID="01"/>
        <LINK ID="03" O1-ID="02" O2-ID="03"/>
        <LINK ID="04" O1-ID="03" O2-ID="01"/>
        <LINK ID="05" O1-ID="03" O2-ID="02"/>
        <LINK ID="06" O1-ID="03" O2-ID="03"/>
    </LINKS>
    <ATTRIBUTES>
        <ATTRIBUTE NAME="salary" ITEM-TYPE="O" DATA-TYPE="INT">
            <ATTR-VALUE ITEM-ID="01">
                  <COL-VALUE>10</COL-VALUE>
            </ATTR-VALUE>
            <ATTR-VALUE ITEM-ID="01">
                  <COL-VALUE>20</COL-VALUE>
            </ATTR-VALUE>
            <ATTR-VALUE ITEM-ID="02">
                  <COL-VALUE>5</COL-VALUE>
            </ATTR-VALUE>
            <ATTR-VALUE ITEM-ID="02">
                  <COL-VALUE>7</COL-VALUE>
            </ATTR-VALUE>
            <ATTR-VALUE ITEM-ID="03">
                  <COL-VALUE>10</COL-VALUE>
            </ATTR-VALUE>
            <ATTR-VALUE ITEM-ID="03">
                  <COL-VALUE>10</COL-VALUE>
            </ATTR-VALUE>
        </ATTRIBUTE>
    </ATTRIBUTES>
</PROX3DB>
