<?xml version="1.0" encoding="UTF-8"?>
<!DOCTYPE PROX3DB SYSTEM "prox3db.dtd">
<PROX3DB>
    <OBJECTS>
        <OBJECT ID="1"/>
        <OBJECT ID="2"/>
        <OBJECT ID="3"/>
    </OBJECTS>
    <LINKS>
        <LINK ID="1" O1-ID="1" O2-ID="2"/>
        <LINK ID="2" O1-ID="1" O2-ID="3"/>
    </LINKS>
    <ATTRIBUTES>
        <ATTRIBUTE NAME="attr1" ITEM-TYPE="O" DATA-TYPE="year:int,gross:int">
            <ATTR-VALUE ITEM-ID="1">
                <COL-VALUE>1995</COL-VALUE>
                <COL-VALUE>1000</COL-VALUE>
            </ATTR-VALUE>
            <ATTR-VALUE ITEM-ID="2">
                <COL-VALUE>1996</COL-VALUE>
                <COL-VALUE>100</COL-VALUE>
            </ATTR-VALUE>
        </ATTRIBUTE>
        <ATTRIBUTE NAME="attr1" ITEM-TYPE="L" DATA-TYPE="year:int">
            <ATTR-VALUE ITEM-ID="1">
                <COL-VALUE>1995</COL-VALUE>
            </ATTR-VALUE>
            <ATTR-VALUE ITEM-ID="2">
                <COL-VALUE>1996</COL-VALUE>
            </ATTR-VALUE>
        </ATTRIBUTE>
        <ATTRIBUTE NAME="attr1" ITEM-TYPE="C" DATA-TYPE="time:int">
            <ATTR-VALUE ITEM-ID="0">
                <COL-VALUE>1</COL-VALUE>
            </ATTR-VALUE>
            <ATTR-VALUE ITEM-ID="1">
                <COL-VALUE>3</COL-VALUE>
            </ATTR-VALUE>
        </ATTRIBUTE>
    </ATTRIBUTES>
    <CONTAINERS>
        <CONTAINER NAME="a" ID="7">
            <SUBG-ITEMS>
                <ITEM SUBG-ID="0" ITEM-ID="1" ITEM-TYPE="O" NAME="A"/>
                <ITEM SUBG-ID="1" ITEM-ID="2" ITEM-TYPE="O" NAME="B"/>
                <ITEM SUBG-ID="2" ITEM-ID="3" ITEM-TYPE="O" NAME="C"/>
                <ITEM SUBG-ID="1" ITEM-ID="1" ITEM-TYPE="L" NAME="X"/>
            </SUBG-ITEMS>
            <SUBG-ATTRIBUTES>
                <SUBG-ATTRIBUTE NAME="attr1" DATA-TYPE="year:int">
                    <ATTR-VALUE ITEM-ID="1">
                        <COL-VALUE>1995</COL-VALUE>
                    </ATTR-VALUE>
                    <ATTR-VALUE ITEM-ID="2">
                        <COL-VALUE>1996</COL-VALUE>
                    </ATTR-VALUE>
                </SUBG-ATTRIBUTE>
            </SUBG-ATTRIBUTES>
            <CONTAINER NAME="b" ID="1">
                <SUBG-ITEMS>
                    <ITEM SUBG-ID="0" ITEM-ID="1" ITEM-TYPE="O" NAME="A"/>
                    <ITEM SUBG-ID="0" ITEM-ID="1" ITEM-TYPE="L" NAME="X"/>
                </SUBG-ITEMS>
                <SUBG-ATTRIBUTES>
                    <SUBG-ATTRIBUTE NAME="attr1" DATA-TYPE="year:int">
                        <ATTR-VALUE ITEM-ID="1">
                            <COL-VALUE>1995</COL-VALUE>
                        </ATTR-VALUE>
                    </SUBG-ATTRIBUTE>
                </SUBG-ATTRIBUTES>
            </CONTAINER>
        </CONTAINER>
        <CONTAINER NAME="c" ID="2"/>
    </CONTAINERS>
</PROX3DB>
